{"version":"1.0","generated":"2025-08-29T20:18:36.592047Z","namespace":"AMCRuleAudience","tools":[{"match":{"operationId":"getAllQueryBasedAudiencesByInstanceId"},"pagination":{"all_pages":false,"limit_param":"limit","default_limit":50,"max_pages":5},"output_transform":{"sample_n":25,"artifact_threshold_bytes":50000}},{"match":{"operationId":"getQueryBasedAudienceByAudienceExecutionId"},"pagination":{"all_pages":false,"limit_param":"limit","default_limit":50,"max_pages":5},"output_transform":{"sample_n":25,"artifact_threshold_bytes":50000}}]}