{
  "version": "1.0",
  "generated": "auto",
  "namespace": "RecommendationsAudienceInsights",
  "tools": [
    {
      "match": {
        "operationId": "insightsGetAudiencesOverlappingAudiences"
      },
      "pagination": {
        "param_name": "nextToken",
        "response_key": "nextToken",
        "all_pages": false,
        "limit_param": "maxResults",
        "default_limit": 100
      },
      "output_transform": {
        "sample_n": 10,
        "artifact_threshold_bytes": 10240
      },
      "input_transform": {
        "arg_aliases": [
          {
            "from": "AudienceId",
            "to": "audienceId"
          },
          {
            "from": "AdType",
            "to": "adType"
          },
          {
            "from": "AdvertiserId",
            "to": "advertiserId"
          },
          {
            "from": "MinimumOverlapAffinity",
            "to": "minimumOverlapAffinity"
          },
          {
            "from": "MaximumOverlapAffinity",
            "to": "maximumOverlapAffinity"
          },
          {
            "from": "AudienceCategory",
            "to": "audienceCategory"
          },
          {
            "from": "MaxResults",
            "to": "maxResults"
          },
          {
            "from": "NextToken",
            "to": "nextToken"
          }
        ]
      }
    }
  ]
}