{
  "version": "1.0",
  "generated": "auto",
  "namespace": "AudiencesDiscovery",
  "tools": [
    {
      "match": {
        "operationId": "listAudiences"
      },
      "pagination": {
        "param_name": "nextToken",
        "response_key": "nextToken",
        "all_pages": false,
        "limit_param": "maxResults",
        "default_limit": 100
      },
      "output_transform": {
        "sample_n": 10,
        "artifact_threshold_bytes": 10240
      },
      "input_transform": {
        "arg_aliases": [
          {
            "from": "AdvertiserId",
            "to": "advertiserId"
          },
          {
            "from": "CanTarget",
            "to": "canTarget"
          },
          {
            "from": "NextToken",
            "to": "nextToken"
          },
          {
            "from": "MaxResults",
            "to": "maxResults"
          },
          {
            "from": "AdType",
            "to": "adType"
          },
          {
            "from": "Countries",
            "to": "countries"
          },
          {
            "from": "Filters",
            "to": "filters"
          }
        ]
      }
    },
    {
      "match": {
        "operationId": "fetchTaxonomy"
      },
      "pagination": {
        "param_name": "nextToken",
        "response_key": "nextToken",
        "all_pages": false,
        "limit_param": "maxResults",
        "default_limit": 100
      },
      "output_transform": {
        "sample_n": 10,
        "artifact_threshold_bytes": 10240
      },
      "input_transform": {
        "arg_aliases": [
          {
            "from": "AdvertiserId",
            "to": "advertiserId"
          },
          {
            "from": "NextToken",
            "to": "nextToken"
          },
          {
            "from": "MaxResults",
            "to": "maxResults"
          },
          {
            "from": "AdType",
            "to": "adType"
          },
          {
            "from": "CategoryPath",
            "to": "categoryPath"
          },
          {
            "from": "Countries",
            "to": "countries"
          }
        ]
      }
    },
    {
      "match": {
        "operationId": "DspAudienceDelete"
      },
      "output_transform": {
        "sample_n": 10,
        "artifact_threshold_bytes": 10240
      }
    },
    {
      "match": {
        "operationId": "DspAudienceEdit"
      },
      "output_transform": {
        "sample_n": 10,
        "artifact_threshold_bytes": 10240
      }
    }
  ]
}