{
  "version": "1.0",
  "generated": "auto",
  "namespace": "AmazonDSPTargetKPIRecommendations",
  "tools": [
    {
      "match": {
        "operationId": "getGsbTargetKpiRecommendation"
      },
      "output_transform": {
        "sample_n": 10,
        "artifact_threshold_bytes": 10240
      }
    }
  ]
}