{
  "version": "1.0",
  "generated": "auto",
  "namespace": "AdsAPIv1DSP",
  "tools": [
    {
      "match": {
        "operationId": "DSPCreateAdAssociation"
      },
      "output_transform": {
        "sample_n": 10,
        "artifact_threshold_bytes": 10240
      },
      "input_transform": {
        "arg_aliases": [
          {
            "from": "AdAssociations",
            "to": "adAssociations"
          }
        ]
      }
    },
    {
      "match": {
        "operationId": "DSPCreateAdGroup"
      },
      "output_transform": {
        "sample_n": 10,
        "artifact_threshold_bytes": 10240
      },
      "input_transform": {
        "arg_aliases": [
          {
            "from": "AdGroups",
            "to": "adGroups"
          }
        ]
      }
    },
    {
      "match": {
        "operationId": "DSPCreateAd"
      },
      "output_transform": {
        "sample_n": 10,
        "artifact_threshold_bytes": 10240
      },
      "input_transform": {
        "arg_aliases": [
          {
            "from": "Ads",
            "to": "ads"
          }
        ]
      }
    },
    {
      "match": {
        "operationId": "DSPCreateCampaign"
      },
      "output_transform": {
        "sample_n": 10,
        "artifact_threshold_bytes": 10240
      },
      "input_transform": {
        "arg_aliases": [
          {
            "from": "Campaigns",
            "to": "campaigns"
          }
        ]
      }
    },
    {
      "match": {
        "operationId": "DSPCreateTarget"
      },
      "output_transform": {
        "sample_n": 10,
        "artifact_threshold_bytes": 10240
      },
      "input_transform": {
        "arg_aliases": [
          {
            "from": "Targets",
            "to": "targets"
          }
        ]
      }
    },
    {
      "match": {
        "operationId": "DSPDeleteAdAssociation"
      },
      "output_transform": {
        "sample_n": 10,
        "artifact_threshold_bytes": 10240
      },
      "input_transform": {
        "arg_aliases": [
          {
            "from": "AdAssociationIds",
            "to": "adAssociationIds"
          }
        ]
      }
    },
    {
      "match": {
        "operationId": "DSPDeleteTarget"
      },
      "output_transform": {
        "sample_n": 10,
        "artifact_threshold_bytes": 10240
      },
      "input_transform": {
        "arg_aliases": [
          {
            "from": "TargetIds",
            "to": "targetIds"
          }
        ]
      }
    },
    {
      "match": {
        "operationId": "DSPQueryAdAssociation"
      },
      "output_transform": {
        "sample_n": 10,
        "artifact_threshold_bytes": 10240
      },
      "input_transform": {
        "arg_aliases": [
          {
            "from": "AdAssociationIdFilter",
            "to": "adAssociationIdFilter"
          },
          {
            "from": "AdGroupIdFilter",
            "to": "adGroupIdFilter"
          },
          {
            "from": "AdIdFilter",
            "to": "adIdFilter"
          },
          {
            "from": "MaxResults",
            "to": "maxResults"
          },
          {
            "from": "NextToken",
            "to": "nextToken"
          }
        ]
      }
    },
    {
      "match": {
        "operationId": "DSPQueryAdGroup"
      },
      "output_transform": {
        "sample_n": 10,
        "artifact_threshold_bytes": 10240
      },
      "input_transform": {
        "arg_aliases": [
          {
            "from": "AdGroupIdFilter",
            "to": "adGroupIdFilter"
          },
          {
            "from": "AdProductFilter",
            "to": "adProductFilter"
          },
          {
            "from": "CampaignIdFilter",
            "to": "campaignIdFilter"
          },
          {
            "from": "MaxResults",
            "to": "maxResults"
          },
          {
            "from": "NextToken",
            "to": "nextToken"
          },
          {
            "from": "StateFilter",
            "to": "stateFilter"
          }
        ]
      }
    },
    {
      "match": {
        "operationId": "DSPQueryAd"
      },
      "output_transform": {
        "sample_n": 10,
        "artifact_threshold_bytes": 10240
      },
      "input_transform": {
        "arg_aliases": [
          {
            "from": "AdIdFilter",
            "to": "adIdFilter"
          },
          {
            "from": "AdProductFilter",
            "to": "adProductFilter"
          },
          {
            "from": "MaxResults",
            "to": "maxResults"
          },
          {
            "from": "NextToken",
            "to": "nextToken"
          }
        ]
      }
    },
    {
      "match": {
        "operationId": "DSPQueryCampaign"
      },
      "output_transform": {
        "sample_n": 10,
        "artifact_threshold_bytes": 10240
      },
      "input_transform": {
        "arg_aliases": [
          {
            "from": "AdProductFilter",
            "to": "adProductFilter"
          },
          {
            "from": "CampaignIdFilter",
            "to": "campaignIdFilter"
          },
          {
            "from": "MaxResults",
            "to": "maxResults"
          },
          {
            "from": "NextToken",
            "to": "nextToken"
          },
          {
            "from": "StateFilter",
            "to": "stateFilter"
          }
        ]
      }
    },
    {
      "match": {
        "operationId": "DSPQueryTarget"
      },
      "output_transform": {
        "sample_n": 10,
        "artifact_threshold_bytes": 10240
      },
      "input_transform": {
        "arg_aliases": [
          {
            "from": "AdGroupIdFilter",
            "to": "adGroupIdFilter"
          },
          {
            "from": "AdProductFilter",
            "to": "adProductFilter"
          },
          {
            "from": "MaxResults",
            "to": "maxResults"
          },
          {
            "from": "NextToken",
            "to": "nextToken"
          },
          {
            "from": "StateFilter",
            "to": "stateFilter"
          },
          {
            "from": "TargetTypeFilter",
            "to": "targetTypeFilter"
          }
        ]
      }
    },
    {
      "match": {
        "operationId": "DSPUpdateAdAssociation"
      },
      "output_transform": {
        "sample_n": 10,
        "artifact_threshold_bytes": 10240
      },
      "input_transform": {
        "arg_aliases": [
          {
            "from": "AdAssociations",
            "to": "adAssociations"
          }
        ]
      }
    },
    {
      "match": {
        "operationId": "DSPUpdateAdGroup"
      },
      "output_transform": {
        "sample_n": 10,
        "artifact_threshold_bytes": 10240
      },
      "input_transform": {
        "arg_aliases": [
          {
            "from": "AdGroups",
            "to": "adGroups"
          }
        ]
      }
    },
    {
      "match": {
        "operationId": "DSPUpdateAd"
      },
      "output_transform": {
        "sample_n": 10,
        "artifact_threshold_bytes": 10240
      },
      "input_transform": {
        "arg_aliases": [
          {
            "from": "Ads",
            "to": "ads"
          }
        ]
      }
    },
    {
      "match": {
        "operationId": "DSPUpdateCampaign"
      },
      "output_transform": {
        "sample_n": 10,
        "artifact_threshold_bytes": 10240
      },
      "input_transform": {
        "arg_aliases": [
          {
            "from": "Campaigns",
            "to": "campaigns"
          }
        ]
      }
    }
  ]
}