{
  "version": "1.0",
  "generated": "auto",
  "namespace": "ReportingMarketingMixModeling",
  "tools": [
    {
      "match": {
        "operationId": "listMmmBrandGroups"
      },
      "output_transform": {
        "sample_n": 10,
        "artifact_threshold_bytes": 10240
      },
      "input_transform": {
        "arg_aliases": [
          {
            "from": "BrandGroupIdFilter",
            "to": "brandGroupIdFilter"
          },
          {
            "from": "CountryCodeFilter",
            "to": "countryCodeFilter"
          },
          {
            "from": "MaxResults",
            "to": "maxResults"
          },
          {
            "from": "NextToken",
            "to": "nextToken"
          }
        ]
      }
    },
    {
      "match": {
        "operationId": "createMmmReport"
      },
      "output_transform": {
        "sample_n": 10,
        "artifact_threshold_bytes": 10240
      },
      "input_transform": {
        "arg_aliases": [
          {
            "from": "Configuration",
            "to": "configuration"
          },
          {
            "from": "Description",
            "to": "description"
          },
          {
            "from": "DueDate",
            "to": "dueDate"
          },
          {
            "from": "EndDate",
            "to": "endDate"
          },
          {
            "from": "ReportName",
            "to": "reportName"
          },
          {
            "from": "StartDate",
            "to": "startDate"
          }
        ]
      }
    },
    {
      "match": {
        "operationId": "deleteMmmReport"
      },
      "output_transform": {
        "sample_n": 10,
        "artifact_threshold_bytes": 10240
      }
    },
    {
      "match": {
        "operationId": "getMmmReport"
      },
      "output_transform": {
        "sample_n": 10,
        "artifact_threshold_bytes": 10240
      }
    }
  ]
}