{
  "version": "1.0",
  "generated": "auto",
  "namespace": "BrandBenchmarks",
  "tools": [
    {
      "match": {
        "operationId": "ListAdvertiserReportMetadata"
      },
      "pagination": {
        "param_name": "nextToken",
        "response_key": "nextToken",
        "all_pages": false,
        "limit_param": "maxResults",
        "default_limit": 100
      },
      "output_transform": {
        "sample_n": 10,
        "artifact_threshold_bytes": 10240
      },
      "input_transform": {
        "arg_aliases": [
          {
            "from": "AdvertiserId",
            "to": "advertiserId"
          },
          {
            "from": "NextToken",
            "to": "nextToken"
          },
          {
            "from": "MaxResults",
            "to": "maxResults"
          },
          {
            "from": "LatestOnly",
            "to": "latestOnly"
          }
        ]
      }
    },
    {
      "match": {
        "operationId": "GetAdvertiserReport"
      },
      "output_transform": {
        "sample_n": 10,
        "artifact_threshold_bytes": 10240
      },
      "input_transform": {
        "arg_aliases": [
          {
            "from": "AdvertiserId",
            "to": "advertiserId"
          },
          {
            "from": "IndexDate",
            "to": "indexDate"
          },
          {
            "from": "ReportType",
            "to": "reportType"
          }
        ]
      }
    }
  ]
}