{
  "version": "1.0",
  "generated": "auto",
  "namespace": "BrandStoresManagement",
  "tools": [
    {
      "match": {
        "operationId": "ListBrandStoreEdition"
      },
      "output_transform": {
        "sample_n": 10,
        "artifact_threshold_bytes": 10240
      }
    },
    {
      "match": {
        "operationId": "QueryBrandStoreEditionPublishVersion"
      },
      "output_transform": {
        "sample_n": 10,
        "artifact_threshold_bytes": 10240
      },
      "input_transform": {
        "arg_aliases": [
          {
            "from": "EditionIdFilter",
            "to": "editionIdFilter"
          },
          {
            "from": "MaxResults",
            "to": "maxResults"
          },
          {
            "from": "NextToken",
            "to": "nextToken"
          },
          {
            "from": "PublishStatusFilter",
            "to": "publishStatusFilter"
          },
          {
            "from": "StoreIdFilter",
            "to": "storeIdFilter"
          }
        ]
      }
    },
    {
      "match": {
        "operationId": "QueryBrandStorePage"
      },
      "output_transform": {
        "sample_n": 10,
        "artifact_threshold_bytes": 10240
      },
      "input_transform": {
        "arg_aliases": [
          {
            "from": "EditionIdFilter",
            "to": "editionIdFilter"
          },
          {
            "from": "MaxResults",
            "to": "maxResults"
          },
          {
            "from": "NextToken",
            "to": "nextToken"
          },
          {
            "from": "PageIdFilter",
            "to": "pageIdFilter"
          },
          {
            "from": "StoreEditionPublishIdFilter",
            "to": "storeEditionPublishIdFilter"
          },
          {
            "from": "StoreIdFilter",
            "to": "storeIdFilter"
          }
        ]
      }
    },
    {
      "match": {
        "operationId": "UpdateBrandStoreEditionPublishVersion"
      },
      "output_transform": {
        "sample_n": 10,
        "artifact_threshold_bytes": 10240
      },
      "input_transform": {
        "arg_aliases": [
          {
            "from": "BrandStoreEditionPublishVersions",
            "to": "brandStoreEditionPublishVersions"
          }
        ]
      }
    },
    {
      "match": {
        "operationId": "UpdateBrandStorePage"
      },
      "output_transform": {
        "sample_n": 10,
        "artifact_threshold_bytes": 10240
      },
      "input_transform": {
        "arg_aliases": [
          {
            "from": "BrandStorePages",
            "to": "brandStorePages"
          }
        ]
      }
    }
  ]
}