{
  "version": "1.0",
  "generated": "auto",
  "namespace": "RecommendationsInsightsPersonaBuilder",
  "tools": [
    {
      "match": {
        "operationId": "BandedSize"
      },
      "output_transform": {
        "sample_n": 10,
        "artifact_threshold_bytes": 10240
      },
      "input_transform": {
        "arg_aliases": [
          {
            "from": "AdvertiserId",
            "to": "advertiserId"
          }
        ]
      }
    },
    {
      "match": {
        "operationId": "Demographics"
      },
      "output_transform": {
        "sample_n": 10,
        "artifact_threshold_bytes": 10240
      },
      "input_transform": {
        "arg_aliases": [
          {
            "from": "AdvertiserId",
            "to": "advertiserId"
          }
        ]
      }
    },
    {
      "match": {
        "operationId": "PrimeVideo"
      },
      "output_transform": {
        "sample_n": 10,
        "artifact_threshold_bytes": 10240
      },
      "input_transform": {
        "arg_aliases": [
          {
            "from": "AdvertiserId",
            "to": "advertiserId"
          }
        ]
      }
    },
    {
      "match": {
        "operationId": "TopCategoriesPurchased"
      },
      "pagination": {
        "param_name": "nextToken",
        "response_key": "nextToken",
        "all_pages": false,
        "limit_param": "maxResults",
        "default_limit": 100
      },
      "output_transform": {
        "sample_n": 10,
        "artifact_threshold_bytes": 10240
      },
      "input_transform": {
        "arg_aliases": [
          {
            "from": "AdvertiserId",
            "to": "advertiserId"
          },
          {
            "from": "MaxResults",
            "to": "maxResults"
          },
          {
            "from": "NextToken",
            "to": "nextToken"
          }
        ]
      }
    },
    {
      "match": {
        "operationId": "TopOverlappingAudiences"
      },
      "pagination": {
        "param_name": "nextToken",
        "response_key": "nextToken",
        "all_pages": false,
        "limit_param": "maxResults",
        "default_limit": 100
      },
      "output_transform": {
        "sample_n": 10,
        "artifact_threshold_bytes": 10240
      },
      "input_transform": {
        "arg_aliases": [
          {
            "from": "AdvertiserId",
            "to": "advertiserId"
          },
          {
            "from": "MaxResults",
            "to": "maxResults"
          },
          {
            "from": "NextToken",
            "to": "nextToken"
          }
        ]
      }
    }
  ]
}