{
  "version": "1.0",
  "generated": "auto",
  "namespace": "ExportsSnapshots",
  "tools": [
    {
      "match": {
        "operationId": "AdGroupExport"
      },
      "output_transform": {
        "sample_n": 10,
        "artifact_threshold_bytes": 10240
      }
    },
    {
      "match": {
        "operationId": "AdExport"
      },
      "output_transform": {
        "sample_n": 10,
        "artifact_threshold_bytes": 10240
      }
    },
    {
      "match": {
        "operationId": "CampaignExport"
      },
      "output_transform": {
        "sample_n": 10,
        "artifact_threshold_bytes": 10240
      }
    },
    {
      "match": {
        "operationId": "GetExport"
      },
      "output_transform": {
        "sample_n": 10,
        "artifact_threshold_bytes": 10240
      },
      "input_transform": {
        "arg_aliases": [
          {
            "from": "ExportId",
            "to": "exportId"
          }
        ]
      }
    },
    {
      "match": {
        "operationId": "TargetExport"
      },
      "output_transform": {
        "sample_n": 10,
        "artifact_threshold_bytes": 10240
      }
    }
  ]
}