{"version":"1.0","generated":"2025-08-29T20:18:36.121281Z","namespace":"AMCWorkflow","tools":[{"match":{"operationId":"listDataSources"},"pagination":{"all_pages":false,"limit_param":"limit","default_limit":50,"max_pages":5},"output_transform":{"projection":["instanceId","dataSourceId","name","category","owner","updatedAt"],"sample_n":5,"artifact_threshold_bytes":50000}},{"match":{"operationId":"getDataSource"},"pagination":{"all_pages":false,"limit_param":"limit","default_limit":50,"max_pages":5},"output_transform":{"projection":["instanceId","dataSourceId","name","category","owner","updatedAt"],"sample_n":5,"artifact_threshold_bytes":50000}},{"match":{"operationId":"listWorkflowExecutions"},"pagination":{"all_pages":false,"limit_param":"limit","default_limit":25,"max_pages":4}},{"match":{"operationId":"listWorkflowExecutions"},"input_transform":{"coerce":["iso_to_amc"],"defaults":{"relative_time":{"minCreationTime":{"days_ago":30}}},"require_any_of":[["workflowId","minCreationTime"]]}},{"match":{"operationId":"getWorkflowExecution"},"pagination":{"all_pages":false,"limit_param":"limit","default_limit":25,"max_pages":4}},{"match":{"operationId":"getWorkflowExecutionDownloadUrls"},"pagination":{"all_pages":false,"limit_param":"limit","default_limit":25,"max_pages":4}},{"match":{"operationId":"listWorkflows"},"output_transform":{"projection":["workflowExecutionId","status","startedAt","endedAt","durationSec"],"sample_n":10,"artifact_threshold_bytes":50000},"input_transform":{"coerce":["iso_to_epoch_ms"]}},{"match":{"operationId":"getWorkflow"},"output_transform":{"projection":["workflowExecutionId","status","startedAt","endedAt","durationSec"],"sample_n":10,"artifact_threshold_bytes":50000},"input_transform":{"coerce":["iso_to_epoch_ms"]}}]}