{
  "version": "1.0",
  "generated": "auto",
  "namespace": "AmazonMarketingStreamSubscriptions",
  "tools": [
    {
      "match": {
        "operationId": "ListDspStreamSubscriptions"
      },
      "output_transform": {
        "sample_n": 10,
        "artifact_threshold_bytes": 10240
      },
      "input_transform": {
        "arg_aliases": [
          {
            "from": "MaxResults",
            "to": "maxResults"
          },
          {
            "from": "StartingToken",
            "to": "startingToken"
          }
        ]
      }
    },
    {
      "match": {
        "operationId": "CreateDspStreamSubscription"
      },
      "output_transform": {
        "sample_n": 10,
        "artifact_threshold_bytes": 10240
      }
    },
    {
      "match": {
        "operationId": "GetDspStreamSubscription"
      },
      "output_transform": {
        "sample_n": 10,
        "artifact_threshold_bytes": 10240
      },
      "input_transform": {
        "arg_aliases": [
          {
            "from": "SubscriptionId",
            "to": "subscriptionId"
          }
        ]
      }
    },
    {
      "match": {
        "operationId": "UpdateDspStreamSubscription"
      },
      "output_transform": {
        "sample_n": 10,
        "artifact_threshold_bytes": 10240
      },
      "input_transform": {
        "arg_aliases": [
          {
            "from": "SubscriptionId",
            "to": "subscriptionId"
          }
        ]
      }
    },
    {
      "match": {
        "operationId": "ListStreamSubscriptions"
      },
      "output_transform": {
        "sample_n": 10,
        "artifact_threshold_bytes": 10240
      },
      "input_transform": {
        "arg_aliases": [
          {
            "from": "MaxResults",
            "to": "maxResults"
          },
          {
            "from": "StartingToken",
            "to": "startingToken"
          }
        ]
      }
    },
    {
      "match": {
        "operationId": "CreateStreamSubscription"
      },
      "output_transform": {
        "sample_n": 10,
        "artifact_threshold_bytes": 10240
      }
    },
    {
      "match": {
        "operationId": "GetStreamSubscription"
      },
      "output_transform": {
        "sample_n": 10,
        "artifact_threshold_bytes": 10240
      },
      "input_transform": {
        "arg_aliases": [
          {
            "from": "SubscriptionId",
            "to": "subscriptionId"
          }
        ]
      }
    },
    {
      "match": {
        "operationId": "UpdateStreamSubscription"
      },
      "output_transform": {
        "sample_n": 10,
        "artifact_threshold_bytes": 10240
      },
      "input_transform": {
        "arg_aliases": [
          {
            "from": "SubscriptionId",
            "to": "subscriptionId"
          }
        ]
      }
    }
  ]
}