{
  "version": "1.0",
  "generated": "auto",
  "namespace": "AccountsAccountBudgets",
  "tools": [
    {
      "match": {
        "operationId": "getAccountBudgetFeatureFlags"
      },
      "output_transform": {
        "sample_n": 10,
        "artifact_threshold_bytes": 10240
      }
    },
    {
      "match": {
        "operationId": "updateAccountBudgetFeatureFlags"
      },
      "output_transform": {
        "sample_n": 10,
        "artifact_threshold_bytes": 10240
      }
    }
  ]
}