{
  "version": "1.0",
  "generated": "auto",
  "namespace": "AMCRuleAudience",
  "tools": [
    {
      "match": {
        "operationId": "createLookalikeAudience"
      },
      "output_transform": {
        "sample_n": 10,
        "artifact_threshold_bytes": 10240
      }
    },
    {
      "match": {
        "operationId": "getAllQueryBasedAudiencesByInstanceId"
      },
      "pagination": {
        "param_name": "nextToken",
        "response_key": "nextToken",
        "all_pages": false,
        "limit_param": "maxResults",
        "default_limit": 100
      },
      "output_transform": {
        "sample_n": 10,
        "artifact_threshold_bytes": 10240
      },
      "input_transform": {
        "arg_aliases": [
          {
            "from": "MaxResults",
            "to": "maxResults"
          },
          {
            "from": "NextToken",
            "to": "nextToken"
          }
        ]
      }
    },
    {
      "match": {
        "operationId": "createQueryBasedAudience"
      },
      "output_transform": {
        "sample_n": 10,
        "artifact_threshold_bytes": 10240
      }
    },
    {
      "match": {
        "operationId": "deleteQueryBasedAudienceByAudienceExecutionId"
      },
      "output_transform": {
        "sample_n": 10,
        "artifact_threshold_bytes": 10240
      },
      "input_transform": {
        "arg_aliases": [
          {
            "from": "AudienceExecutionId",
            "to": "audienceExecutionId"
          }
        ]
      }
    },
    {
      "match": {
        "operationId": "getQueryBasedAudienceByAudienceExecutionId"
      },
      "output_transform": {
        "sample_n": 10,
        "artifact_threshold_bytes": 10240
      },
      "input_transform": {
        "arg_aliases": [
          {
            "from": "AudienceExecutionId",
            "to": "audienceExecutionId"
          }
        ]
      }
    },
    {
      "match": {
        "operationId": "updateQueryBasedAudienceByAudienceExecutionId"
      },
      "output_transform": {
        "sample_n": 10,
        "artifact_threshold_bytes": 10240
      },
      "input_transform": {
        "arg_aliases": [
          {
            "from": "AudienceExecutionId",
            "to": "audienceExecutionId"
          }
        ]
      }
    }
  ]
}