{
  "version": "1.0",
  "generated": "auto",
  "namespace": "AccountsProfiles",
  "tools": [
    {
      "match": {
        "operationId": "listProfiles"
      },
      "output_transform": {
        "sample_n": 10,
        "artifact_threshold_bytes": 10240
      },
      "input_transform": {
        "arg_aliases": [
          {
            "from": "ApiProgram",
            "to": "apiProgram"
          },
          {
            "from": "AccessLevel",
            "to": "accessLevel"
          },
          {
            "from": "ProfileTypeFilter",
            "to": "profileTypeFilter"
          },
          {
            "from": "ValidPaymentMethodFilter",
            "to": "validPaymentMethodFilter"
          }
        ]
      }
    },
    {
      "match": {
        "operationId": "updateProfiles"
      },
      "output_transform": {
        "sample_n": 10,
        "artifact_threshold_bytes": 10240
      }
    },
    {
      "match": {
        "operationId": "getProfileById"
      },
      "output_transform": {
        "sample_n": 10,
        "artifact_threshold_bytes": 10240
      },
      "input_transform": {
        "arg_aliases": [
          {
            "from": "ProfileId",
            "to": "profileId"
          }
        ]
      }
    }
  ]
}